,0,1,2,3,4,5
103,Test Engineer Intern Winter 4 Months,Ceridian,3.6,"Toronto, ON","Posted
Posted 4 days ago","Job Title: Test Engineer Intern
Department: Product & Technology
Work Term & Duration: Winter 4 Months
Location: Virtual

Ceridian is a global leader in Human Capital Management technology. Simply put, we allow our customers to do the most complex things well (HR, Payroll, Benefits Administration, Workforce Management and Talent Management) and do them to scale. Makes Work Life Better™ is our brand promise, not only to our customers, but to our employees as well. Our flagship platform, Dayforce, helps leaders make smart decisions based on data, strategy and intelligence that create value and maximize productivity.

Benefits for Students:
Experience working for one of the fastest growing Human Capital Management technology companies in the world Access to Ceridian’s development programs and resources
Ability to work with as well as create relationships with members across the globe
Autonomy to bring forth new ideas and optimize existing structures within the organization
Meaningful responsibilities, enabling you to obtain ‘real-world’ experience
Dynamic hands-on exposure to multiple business-units and stakeholders across Ceridian
Roles Available:
Test Engineer Intern – Talent Intelligence Team (1 role)
Hired Intern for this role will closely work with developers in the team and will directly report to the Development Manager. Intern will be primarily responsible for contributing to software development activities including development and testing of deliverables throughout the development life cycle. This is an excellent opportunity to join a rapidly growing innovator in a technically challenging and rewarding role. By working with team of software enthusiasts, you will develop deep technical expertise and gain valuable business and industry related experience.

Test Engineer Intern – Experience Services Team (1 role)
We are looking for a Test Automation Engineer to devise quality automated tests for a key module, the Dayforce Hub. This will tailor the Dayforce experience with their branding and content through configurable widgets and styles. The goal is to increase employee engagement and alignment with organizational culture.

Test Engineer Intern – P&T Team (1 role)
We are looking for a Software Developer Intern to join our Web Framework team to build & enhance the UI foundations of the Dayforce solution.

Primary Responsibilities:
Actively participate in continuous application improvements by developing automated tests and in development of quality product and processes to deliver industry leading cloud based HCM solutions
Coordinate with developers, QA analysts and product owners to produce stable, maintainable and reliable automated tests
Actively participate in test automation initiatives, architect test harnesses and infrastructure frameworks to run automated tests
Ensure automated tests are effectively covering new product features and associated requirements
Investigate, report, and track product failures to resolution. Deal with the false-positives that come up with automated testing, ensuring the test suite remains up to date
Identify and offer ways to improve code testability and maintainability
Be adaptable in learning new methodologies and technologies to improve the automated testing processes
Participate in the creation and execution of test plans and test cases
Ensure traceability between product requirements, delivered code and test case verification
Identify and escalate issues related to plan and quality
Improve and implement automation framework code to expand automated test coverage
Qualifications:
In progress College or University degree course in Computer Science or related field
Smart and driven individual who is passionate about learning new technologies and building high quality cloud applications
Strong academic performance in courses regarding programming languages, algorithms and data structures, computer organization, and discrete mathematics.
Disciplined self-starter, capable of working independently or in close collaboration within an agile development team
Excellent communication and collaboration skills
Experience with manual or automated testing of Android and iOS applications
Strong coding skills in a modern object-oriented language (e.g., C#, Java, C++)
Working knowledge of modern web technologies including: JavaScript, HTML, CSS 3, SVG, JSON, etc. from professional or academic projects
Good understanding of software development principles and basic knowledge of writing code with use of OOP concepts
Working knowledge of modern relational databases architecture and SQL language through professional or academic projects
Understanding of Software Development Life Cycle and relevant quality assurance concepts
Passion for solving hard problems and knows how to have fun!
Nice to have:
Strong understanding of programming knowledge and concepts with a front-end focus
Experience with modern JavaScript libraries such as Dojo, React, Angular, Ember, Backbone, etc.
Experience working with SaaS Enterprise Software
Experience with automated performance testing
Experience working with enterprise cloud application
Experience with .NET framework
Experience working with C#
Experience working any of the following testing tools: Selenium, FitNesse, SpecFlow, Jenkins, JMeter, Cucumber, TestNG, Espresso, XCUITest or RESTful API services
Experience with Content Management Systems (CMS) an asset. E.g. Umbraco, Orchard, Kentico, Joomla, Drupal, etc.
We understand that no matter where you are, choosing a new employer is always one of life’s most stressful events. We encourage you to check us out at Ceridian.com or follow us on LinkedIn to learn more about how we are impacting the world of work for our customers, employees and you!

Ceridian is fueled by the diversity of our talented employees. We are an equal opportunity employer and consider and embrace ALL individuals and what makes them unique. We believe our employees should be happy and healthy, with peace of mind and a sense of fulfillment. We provide our employees with comprehensive benefits for various life circumstances and needs, great opportunities for career development, and a balanced lifestyle to achieve personal and professional success. We encourage all individuals to apply for positions that fit their passions.

We thank all applicants in advance for their interest in this position; however, only those selected for an interview will be contacted. If you are selected for an interview, you will be contacted by a Ceridian Recruiter with a @ceridian.com email directly from our organization."
104,Junior Web Developer,Altis Recruitment,4.1,"Remote in Toronto, ON","Posted
Posted 30+ days ago","Do you enjoy creating and updating websites? Do you enjoy working with PHP? Do you love working from your home office? One of our clients in the mortgage industry is seeking a Junior Web Developer to join their team on a full-time permanent basis.
This role is fully remote.
Roles and Responsibilities
Troubleshoot, debug and upgrade existing software
Gather and evaluate feedback from user experiences
Recommend and execute improvements for a better user experience
Create technical documentation
Qualifications and Experience
Bachelor’s Degree in Computer Science or equivalent
5+ years experience in web development
5 years of PHP experience preferred
#AltIT
Job Type: Full-time
Salary: $80,000.00-$100,000.00 per year
Schedule:
8 hour shift"
105,Remote - Product Software Engineer DocSend,Dropbox,404,"Remote in Toronto, ON","Posted
Posted 3 days ago","Role Description As a Software Engineer, you ll play a pivotal role in shaping the trajectory of product development, while ensuring we stay customer-focused.
Our current stack is a Ruby on Rails web app running on Heroku with CoffeeScript, Haml, and LESS with some React.
Responsibilities Take ownership of features end-to-end Research, architect, implement, and help drive innovative solutions Actively share knowledge and document insights to support continuous team improvement and collaboration Act as a mentor throughout the software development process Requirements BS (or higher, e.g., MS, or PhD) in Computer Science or related technical field involving coding (e.g., physics or mathematics), or equivalent technical experience 2+ years of experience building web applications professionally Solid CS fundamentals with one or more area of deep knowledge and experience Proven track record of shipping impactful features, end-to-end About DocSend, a Dropbox Company DocSend is shaping the future of how businesses put documents to work.
Our 23,000 customers rely on us to send documents or folders with a single link, track who s interacting with those documents, and get key contracts and NDAs signed.
From founders to sales teams, we power the most important documents while delivering unparalleled security and control.
Total Rewards At Dropbox, we strive to be a great place for all Dropboxers to grow and be recognized for that growth.
This job posting reflects broad requirements, and represents two potential levels of role.
Through our assessment process, we will identify your level that ties to compensation based on your experience and technical expertise along with the scope of the role.
Our Engineering Career Framework is viewable by anyone outside the company and describes what s expected for our engineers at each of our career levels.
Check out our blog post on this topic and more here.
For candidates hired in Colorado, the expected salary/On-Target Earnings (OTE) range for the role is $117,600 - $138,400 - $159,200 if you are assessed at the IC2 level.
If you are instead assessed at the IC3 level, the expected salary/On-Target Earnings (OTE) range for the role is $142,800 - $168,000 - $193,200.
This salary/OTE range represents the low, middle, and high end of the salary or OTE (Sales roles) range for this position, and is subject to change.
To determine a Dropboxer s starting pay we carefully consider a variety of factors, including primary work location and an evaluation of a candidate s skills, experience, market demands, and internal parity.
This position may be considered a promotional opportunity.
Salary/OTE is just one component of Dropbox s total rewards package.
All regular employees are also eligible for the corporate bonus program or a sales incentive (target included in OTE) as well as stock in the form of Restricted Stock Units (RSUs).
Dropbox is committed to investing in the holistic health and wellbeing of all Dropboxers and their families.
Our benefits and perks programs include, but are not limited to: Competitive medical, dental and vision coverage (US Only) Competitive 401(k) Plan with a generous company match and immediate vesting Flexible Time Off/Paid Time Off, paid holidays, 11 Company-wide PTO days, Volunteer time off and more Protection Plans including; Life Insurance, Disability Insurance and Travel benefit plans Perks Allowance to be used on what matters most to you, whether that s wellness, learning and development, food & groceries, and much more Parental benefits including; Parental Leave, Child and Adult Care, Day Care FSA (US Only), Fertility Benefits (US Only), Adoption and Surrogacy support and Lactation Support Mental Health and Wellness benefits Free Dropbox space for your friends and family Additional benefits details are available upon request."
106,Full Stack Developer (Node JS and React JS),SkillsHawk (powered by Creatros Technologies Inc),4.8,"Remote in Toronto, ON","Posted
Posted 5 days ago","Creatros Technologies is looking for a web-savvy Full Stack Developer to join the team, who will work with dynamic and passionate teams from Customer Experience, frontend, backend, and R&D teams to help develop and maintain an exceptional AI-based product in the project management space.
As a Full Stack Developer, you are passionate about high-quality software development and solving tough problems hosted in the AWS serverless cloud environment. Our ideal candidate is detail oriented, a good communicator, and thrives in a fast-paced environment.
You will be helping to drive the direction of technology, strategizing on how to implement new features and practices. You will also help introduce new tools and paradigms to the company in line with emerging best practices and the latest technology trends.
Responsibilities:
· Contribute to the design of scalable software platforms with performance and security in mind
· Participate in the entire application lifecycle, focusing on coding and debugging
· Gather and address technical and design requirements
· Work with team members to collaboratively define the roadmap for features and tools
· Design and build client-side and server-side architecture
· Develop and manage well-functioning databases (Primarily no-sql) and applications.
· Write effective APIs
· Create security and data protection settings
· Clearly communicate with the team through our productivity tools (Slack, Jira, GitHub, etc …)
· Practice test-driven development
· Analyze and troubleshoot production issues in a timely fashion
· Contribute to documentation, functional specifications, design documents and architecture diagrams
· Maintain strict confidentiality of records, client information, and company information
· Other job-related duties may be assigned as required
Qualifications: Required:
· 1-3 years experience as a Full Stack Developer
· Knowledge of React JS front-end libraries. Knowledge of other languages and libraries will be considered a plus.
· Knowledge of Node JS for the backend. Python knowledge will plus. Any other backend language knowledge will be welcomed.
· Familiarity with databases and AWS cloud infrastructure (AWS lambda, static website, DynamoDB, cloud formation, etc)
· Experience working in an Agile Development environment with continuous integrations/continuous deployment environments
· Demonstrated problem-solving and decision-making skills
· Proven history of excelling in a team-based, collaborative environment
What sets you apart:
· Self-learner with a strong interest in emerging technologies
· Flexible, able to adapt to changing environments, and work under pressure
· Strong ability to work independently
· Problem solver, organized, and collaborative
· Strong written and interpersonal communication skills
Job Type: Full-time
Job Location: Remote.
Salary: Negotiable
Job Types: Full-time, Permanent
Salary: $75,000.00-$90,000.00 per year
Benefits:
Casual dress
Flexible schedule
Work from home
Flexible Language Requirement:
French not required
Schedule:
8 hour shift
Day shift
Application deadline: 2022-10-14"
107,Jr Automation Developer Student- (4 Months)- Winter 2023- Ca...,"Canadian Tire Corporation, Limited",3.5,"Remote in Toronto, ON","Posted
Posted 8 days ago","Help us boldly shape retail in Canada
Canadian Tire Corporation’s (CTC) rich heritage of serving Canadians from coast-to-coast dates back to 1922. Our vision is to become the #1 retail brand in Canada and we are focused on innovating and making important investments in our business, especially when it comes to our people. To reach our goal, we need the best talent to help us evolve and drive change across the business – and boldly help shape Canada’s retail industry. As we strive to be at the forefront of a complex and vastly changing retail industry, it is an exciting time to join the Canadian Tire family of companies.
Job Title: Jr. Automation Developer Student- (4 Months)- Winter 2023- Canadian Tire Corporation
Location: Remote/ Toronto
Work Term/Duration: Winter 2023- 4 months (Jan 2023 – Apr 2023)

Help us boldly shape retail in Canada
Canadian Tire Corporation, Limited (“CTC”) is one of Canada’s most admired and trusted companies. With world-class Owned Brands and exciting market-leading merchandising strategies, we are continually innovating with purpose: to be there for Canadians from coast-to-coast. We are relentlessly focused on innovating at every level of our business, investing in new technologies and products, and doubling down on the best talent to drive the company forward. It is an especially exciting time to join Canadian Tire and its group of companies.
At Canadian Tire we work flexibly embracing ‘Hybrid’ whereby individuals utilize a combination of working at a CTC campus and or virtually in service of outcomes. Determined by managers, decisions around work location will be made based on business and team needs and grounded in a desire to support individual well-being and personal needs. Our goal is to empower teams and individuals to make the right decisions for them, and we expect that to look different for everyone.
Our Commitment to students:
Work in an environment that supports, and fosters knowledge sharing and provides key experiences to increase capabilities through projects or objectives.
There will be specific and measurable objectives/goals that will support learning & achieving relevant business deliverables.
Continue to support Canadian Tire’s culture of learning from others, continuous improvement, agility, growth and innovation.
Investment in the community to create a talented diverse workforce for Canada and Canadian Tire’s future.
Building & strengthening student social engagement throughout their education and pursuit of their career through ongoing communication and relationship building.
Position Summary
As part of the Intelligent Automation Centre of Excellence. You will design and program Process Automation solutions (Bots) by analyzing operational processes and recommending scope for automation; using advanced programming and configuration skills to deliver on automation projects across the enterprise.
What you’ll do:
Primary responsibilities include:
Seek opportunities for automation
Determine business needs, and recommend suitability for automation
Elicit, document and manage stakeholder requirements in order to meet business and project objectives
Build sufficient controls and metrics into processes being automated
Develop solutions by preparing and evaluating alternative workflow solutions
Development and configuration of systems
Coding and configuring Bots
Rapidly develop Bots based on process designs
Draft test plans and validate results by testing automated processes
Provide reference by writing documentation
Building Proficiency / knowledge of Robotic Process Automation suites
Who you are:
Exceptional communication skills with the confidence and passion to share knowledge
Creative thinker who is observant to seek new opportunities and perceptive to abstract ideas
Goal driven individual to seek out continuous improvement opportunities
The ability to take a collaborate approach to build strong relationships and have positive team experiences
Flexible and dynamic individual who is able to adjust and prioritize accordingly to adapt to business demands and requirements
Solid foundation of relevant technical skills
Demonstrates behaviours of transparency, accountability agility and learning from others that will support your success
Thrive at solving problems and are able to balance and prioritize activities
Drive innovation with a ‘think outside of the box’ mindset
Take initiative and are able to successfully manage projects
Build relationships easily, and are collaborative team players with strong communication skills
What you’ve done:
Experience in software requirements analysis
Experienced in programming concepts and multiple programming languages (Java, Python, Selenium)
A quick learner and have an ability to adapt to new and emerging situations
Curious about the emerging field of Robotic Process Automation, Cognitive learning and Artificial Intelligence
Experienced with Agile and DevOps methodologies
Driven by problems and challenges that require critical thinking
Passionate about leveraging emerging technology to simplify processes
A strong communicator - Verbal and Written
Canadian Tire and its family of companies are boldly shaping retail in Canada and we continue to deliver a positive experience for our customers. As one of the most trusted brands in Canada, our employees take pride in the work we do across the country. It’s more than the iconic triangle that keeps our employees around. From benefits and perks, to learning and development opportunities, to our commitment to Jumpstart – these are some of the many reasons why Canadian Tire Corporation is one of
Canada’s Best Managed Companies
.
To learn more about this team and the Canadian Tire family of companies follow us on
LinkedIn
.
Canadian Tire is an equal opportunity employer. We are committed to a diverse and inclusive workplace for all. We recognize that our future success depends on the perspectives and contributions of all our employees - their diverse backgrounds, abilities and experiences make our business stronger. If you are contacted for a job opportunity, please advise us of any accommodations needed to ensure fair and equitable access throughout the recruitment and selection process. All accommodation information provided will be treated as confidential and used only for the purpose of providing an accessible candidate experience."
108,Programmer/Analyst,KUBRA,3.2,"Greater Toronto Area, ON","Posted
Posted 10 days ago","Overview:
KUBRA is looking for passionate Programmer/Analysts to join our growing team!

As a Junior Programmer/Analyst within KUBRA, you will be working on one of our many customer-driven programming Support teams, providing support to our clients while building upon your knowledge of development and interface design utilizing the following technologies / design principles: C#, ASP.NET, VB.NET, SQL Server, HTML5, CSS, RWD, AODA/ADA and JavaScript.

This is a hybrid opportunity based in our Mississauga, ON office.

This is an entry level opportunity offering high-potential for growth and advancement into further programming/development roles within KUBRA.

What you get to do every day:
As a Programmer/Analyst, you will be heavily involved in programming and customer support activities – In doing so, you will provide first response by phone and/or by email to clients upon receipt of case/tickets; investigate, analyse, debug, and rectify simple and minor issues; and follow-up on customer needs, concerns, or inquiries, and handle troubleshooting to ensure requirements are met
Implement simple code, application edits, and cosmetic (re)designs within established application functions and procedures, potentially involving rewriting and adding whole new application functions and procedures
Analyze, design, implement (Execution of Coding and Form Design), test, communicate and coordinate parallel testing and migration with both Client and QA
Perform work outlined by Team Leader via the Case Management System and the Project and Implementation Infrastructures
Participate in customer requirement studies to gather information and understand customer needs/requirements
Perform all assigned project tasks to execute Statement of Work (SOW)
Compose and publish knowledgebase articles
Provide on-call after hours support on a rotating basis/as required
What kind of person should you be?:
A coder and skilled problem solver who enjoys working in a tight-knit group
An excellent communicator both when writing and speaking – you’re comfortable speaking with clients and coordinating with internal teams to ensure timely resolution of support-related cases
Someone who is open to learning new technologies and, on occasion, working with legacy applications
Someone who gets excited about making our customers happy
A sense of humor goes a long way!
What skills do you need?:
A Degree/Diploma in Computer Science or a related field
1 - 3 years of hands-on programming experience – recent grads are welcome!
Previous experience in customer support or client facing roles considered an asset
Demonstrated ability implementing core solutions utilizing effective programming and database technologies
Demonstrated knowledge of relational database technology
What can you expect from us?:
Award-winning culture that fosters growth, diversity and inclusion for all
Paid day off for your birthday
Access to LinkedIn learning courses
Continued education with our education reimbursement program
Flexible schedules
Free unlimited access to our refreshment stations (fully stocked with tea, coffee and other beverages)
Two paid days for volunteer opportunities
KUBRA is a fast-growing company that delivers customer communications solutions to some of the largest utility, insurance, and government entities across North America. KUBRA offers billing and payments, mapping, mobile apps, proactive communications, and artificial intelligence solutions for customers. With more than 1.5 billion customer interactions annually, KUBRA services reach over 40% of households in the U.S. and Canada. KUBRA is an operating subsidiary of Hearst.

Our office is small enough to allow creative individuals to flourish, yet large enough to provide long-term stability. We place a tremendous amount of responsibility on our team members to be productive, focused and self-motivated. We offer a casual work environment, competitive compensation and a stellar benefits program.

KUBRA is an equal opportunity employer dedicated to building an inclusive and diverse workforce. We will provide accommodations during the recruitment process upon request. Information received relating to accommodation will be addressed confidentially. We thank all applicants for their interest; however, only candidates under consideration will be contacted"
