,0,1,2,3,4,5
75,"MTS 1, Software Engineer",eBay Inc.,3.9,"Remote in Toronto, ON","Posted
Posted 5 days ago","Looking for a company that inspires passion, courage and creativity, where you can be on the team shaping the future of global commerce? Want to shape how millions of people buy, sell, connect, and share around the world? If you’re interested in joining a purpose driven community that is dedicated to crafting an ambitious and inclusive work environment, join eBay – a company you can be proud to be with.
The Role
Do you want to make an impact on the world’s largest e-commerce website? Are you interested in building performance efficient, high-volume, and highly scalable distributed systems? We have a place for you!
We are looking for a backend software engineer to work in the Shipping/Logistics group that makes shipping and logistics as seamless to eBay sellers and buyers as possible. You will work on large-scale applications processing millions of transactions in a minute. As a self-motivated and enthusiastic member of our team, you will work with extremely talented peers in a fun environment and build world class products. You will work in an agile environment with a focus on problem solving and engineering excellence.
Responsibilities:
Build solutions using your strong background in large scale web applications and systems.
Research, analyze, design, develop and test solutions that are appropriate for the business and technology strategies.
Participate in design discussions, code reviews and project related team meetings.
Work with other software engineers, architects, product owners, and operations teams to develop innovative solutions that meet business needs with respect to functionality, performance, scalability, reliability, realistic implementation schedules and adherence to development principles and product goals.
Develop technical & domain expertise and apply to solving product challenges.
Job Requirements:
Bachelor's Degree with 5 years of software engineering experience or Master’s degree with 4 years of experience in software design and development.
Solid foundation in computer science with strong competencies in data structures, algorithms, and software design.
Expert knowledge in practising OOAD, architectural and design patterns, open-source platforms, frameworks, technologies, and software engineering methodologies.
Hands-on experience in Java/J2EE, XML, Web Technologies, Web Services, Design Patterns, and OOAD.
Experience developing data-driven applications using an industry standard RDBMS and NoSQL.
Hands-on experience in using source control systems such as GitHub, issue tracking systems like JIRA.
Great knowledge and practice in agile development.
Ability to adapt to changing business priorities and to thrive under pressure.
Excellent decision-making, communication and collaboration, skills.
Experience in leading team and mentoring junior engineers a plus.
Benefits are an essential part of your total compensation for the work you do every day. Whether you’re single, in a growing family, or nearing retirement, eBay offers a variety of comprehensive and competitive benefit programs to meet your needs. Including maternal & paternal leave, paid sabbatical, and plans to help ensure your financial security today and in the years ahead because we know feeling financially secure during your working years and through retirement is important.
Here at eBay, we love creating opportunities for others by connecting people from widely diverse backgrounds, perspectives, and geographies. So, being diverse and inclusive isn’t just something we strive for, it is who we are, and part of what we do each and every single day. We want to ensure that as an employee, you feel eBay is a place where, no matter who you are, you feel safe, included, and that you have the opportunity to bring your unique self to work. To learn about eBay’s Diversity & Inclusion click here: https://www.ebayinc.com/company/diversity-inclusion/
eBay Inc. is an equal opportunity employer. All qualified applicants will receive consideration for employment without regard to race, color, religion, national origin, sex, sexual orientation, gender identity, veteran status, and disability, or other legally protected status. If you are unable to submit an application because of incompatible assistive technology or a disability, please contact us at talent@ebay.com. We will make every effort to respond to your request for disability assistance as soon as possible. Jobs posted with location as ""Remote - United States (Excludes CO, HI, NM)"" excludes Colorado, Hawaii and New Mexico.
For more information see: EEO is the Law Poster and EEO is the Law Poster Supplement

This website uses cookies to enhance your experience. By continuing to browse the site, you agree to our use of cookies
View our privacy policy and accessibility info"
76,"Software Engineer, DocSend - Remote",Dropbox,404,"Remote in Mississauga, ON
+1 location","Posted
Posted 4 days ago","Role Description As a Software Engineer, you ll play a pivotal role in shaping the trajectory of product development, while ensuring we stay customer-focused.
Our current stack is a Ruby on Rails web app running on Heroku with CoffeeScript, Haml, and LESS with some React.
Responsibilities Take ownership of features end-to-end Research, architect, implement, and help drive innovative solutions Actively share knowledge and document insights to support continuous team improvement and collaboration Act as a mentor throughout the software development process Requirements BS (or higher, e.g., MS, or PhD) in Computer Science or related technical field involving coding (e.g., physics or mathematics), or equivalent technical experience 2+ years of experience building web applications professionally Solid CS fundamentals with one or more area of deep knowledge and experience Proven track record of shipping impactful features, end-to-end About DocSend, a Dropbox Company DocSend is shaping the future of how businesses put documents to work.
Our 23,000 customers rely on us to send documents or folders with a single link, track who s interacting with those documents, and get key contracts and NDAs signed.
From founders to sales teams, we power the most important documents while delivering unparalleled security and control.
Total RewardsAt Dropbox, we strive to be a great place for all Dropboxers to grow and be recognized for that growth.
This job posting reflects broad requirements, and represents two potential levels of role.
Through our assessment process, we will identify your level that ties to compensation based on your experience and technical expertise along with the scope of the role.
Our Engineering Career Framework is viewable by anyone outside the company and describes what s expected for our engineers at each of our career levels.
Check out our blog post on this topic and more here.
For candidates hired in Colorado, the expected salary/On-Target Earnings (OTE) range for the role is $117,600 - $138,400 - $159,200 if you are assessed at the IC2 level.
If you are instead assessed at the IC3 level, the expected salary/On-Target Earnings (OTE) range for the role is $142,800 - $168,000 - $193,200.
This salary/OTE range represents the low, middle, and high end of the salary or OTE (Sales roles) range for this position, and is subject to change.
To determine a Dropboxer s starting pay we carefully consider a variety of factors, including primary work location and an evaluation of a candidate s skills, experience, market demands, and internal parity.
This position may be considered a promotional opportunity.
Salary/OTE is just one component of Dropbox s total rewards package.
All regular employees are also eligible for the corporate bonus program or a sales incentive (target included in OTE) as well as stock in the form of Restricted Stock Units (RSUs).
Dropbox is committed to investing in the holistic health and wellbeing of all Dropboxers and their families.
Our benefits and perks programs include, but are not limited to: Competitive medical, dental and vision coverage (US Only) Competitive 401(k) Plan with a generous company match and immediate vesting Flexible Time Off/Paid Time Off, paid holidays, 11 Company-wide PTO days, Volunteer time off and more Protection Plans including; Life Insurance, Disability Insurance and Travel benefit plans Perks Allowance to be used on what matters most to you, whether that s wellness, learning and development, food & groceries, and much more Parental benefits including; Parental Leave, Child and Adult Care, Day Care FSA (US Only), Fertility Benefits (US Only), Adoption and Surrogacy support and Lactation Support Mental Health and Wellness benefits Free Dropbox space for your friends and family Additional benefits details are available upon request."
77,Software Developer,Softek Computer Services Incorporated,404,"Toronto, ON","Posted
Posted 30+ days ago","We are seeking a talented, technically experienced individual for a full-time position as a Software Developer in our fast growing organization that serves the financial services industry in Toronto, New York and London. This position is located in Toronto (western GTA). Reporting to Softek’s Systems Architect, the successful candidate will work directly with technical and business users and customers on Softek’s software products. The candidate will use basic and advanced programming techniques to implement solutions for desktop and server programming on Microsoft platforms. Advanced individuals, whether based on previous experience, or as a result of internal promotion, will use increasingly advanced techniques. Structured, object oriented and relational programming paradigms are required knowledge, but difficult to obtain. Training in financial industry specific patterns will be provided on the job as necessary.
The position requires working in a team, making communication and interpersonal skills essential. This is an exciting opportunity to work with and learn from senior experienced financial and technology professionals in a collaborative, entrepreneurial, and fast-paced environment.
Responsibilities:
Program and script development which includes data interfaces and custom reports
Software implementations and upgrades
Support for end users to troubleshoot, diagnose and resolve complex technical issues
Configure and test software to meet Softek or customer specifications
Coordination with internal /external staff to ensure on-time project deliveries
Skills and Requirements:
Undergraduate degree in Computer Science/Engineering, or other technical discipline with 3-5 working years’ experience in the field
Experience with C#, VB.NET and at least one of C, C++, TSQL programming languages
Knowledge of relational databases and SQL
Experience with Microsoft SQL Server and Visual Studio a plus
Knowledge of finance and capital markets a plus
Oral and written proficiency in English
Strong analytical, problem solving and organizational skills
Self-motivated and ability to work both independently and under direction
Ability to work in a collaborative team environment
Flexibility to work both regular business hours as well as after hours and on weekends
Will provide a “clean” police background check
Qualified candidates should send a covering letter and their resume.
Please no phone calls. Only qualified candidates selected for an interview will be contacted. We thank you for your interest in this position!
Successful candidates must be vaccinated for Covid 19.
Job Type: Full-time
Schedule:
Monday to Friday
Ability to commute/relocate:
Toronto, ON: reliably commute or plan to relocate before starting work (required)"
78,Back End Developer - .Net experience,Elecsoft,404,"Temporarily Remote in Toronto, ON",Hiring ongoing,"Help build a brand new software product from ground-up.
Job Duties:
Defines site objectives by analyzing user requirements; envisioning system features and functionality.
Designs and develops internet applications by setting expectations and features priorities throughout development life cycle; determining design methodologies and tool sets; completing programming using languages and software products; designing and conducting tests.
Recommends system solutions by comparing advantages and disadvantages of custom development, Frameworks, and purchase alternatives.
Integrates applications by designing database architecture and server scripting; studying and establishing connectivity with network systems.
Completes applications development by coordinating requirements, schedules, and activities; contributing to team meetings; troubleshooting development and production problems across multiple environments and operating platforms.
Enhances organization reputation by accepting ownership for accomplishing new and different requests; exploring opportunities to add value to job accomplishments.
Collaborate with the Product Manager to help resolve production issues.
Skills and Qualifications:
Degree or Diploma in Computer Science, Engineering, or Information Systems
Knowledge/Experience with Object-Oriented Design, Relational and/or Non-Relational Databases is Required (3+ Years) * Experience with .NET, ASP.NET, Web API, REST is Required (3+ Years)
(Nice to Have) Experience with Elasticsearch or equivalent NoSQL, Message Brokers (E.g. RabbitMQ).
Job Types: Full-time, Contract, Permanent
Salary: $61,241.00-$120,000.00 per year
Benefits:
Casual dress
Paid time off
Schedule:
8 hour shift
Monday to Friday
Supplemental pay types:
Bonus pay
COVID-19 considerations:
Team members are allowed to work from home until it is fully safe to resume work from office.
Work remotely:
Temporarily due to COVID-19"
79,Events Mobility - Software Engineer II - iOS,Uber,3.6,"Toronto, ON","Posted
Posted 30+ days ago","About the role:
Collaborates with team members to design, develop, and maintain user interfaces and features for mobile applications (iOS). Mobile iOS Engineers will have the opportunity to work remotely.

CORE COMPETENCIES:

Technical Competency: Maintains and applies knowledge of mobile platforms, frameworks, and modules to design, develop, and maintain user interfaces and features for mobile applications (Android, iOS). Adopts Uber standards and learns and applies industry standards to produce mobile solutions that are balanced between cross-platform standardization and platform-specific optimization while considering technical constraints, impact on other functions (e.g., backend, product, design), and complexities of user experience. Helps define Uber technical standards for the team.

Coding: Writes high-quality code (i.e., reliable, readable, efficient, testable), provides quality code reviews, and creates comprehensive tests and quality documentation to solve moderately complex problems. This includes knowledge of data structures, algorithms, programming and associated programming languages and frameworks, and major phases/activities of the software research and development life cycle (e.g., requirements, design, build, experiment, test, debug, deploy, monitor). Monitors, reports, and ensures resolution of technical problems according to standards and best practices.

Design & Architecture: Works with stakeholders to understand customer and/or business requirements. Applies knowledge of software design principles and methods and evaluates trade-offs of different architectural decisions to contribute to the translation of requirements into effective design documents.

Efficiency & Being a Force Multiplier: Creates and promotes efficiency and speed within the team by leveraging and improving existing solutions. Proactively improves the performance and efficiency of own software and systems.

Operational Execution: Executes well-defined technical projects and solutions with drive and appropriate sense of urgency to deliver technical and business impact. Plans, organizes, and manages own tasks, resources, and timelines to accomplish work accurately and on time. Defines and diagnoses problems and determines an appropriate solution, recommendation, or decision while logically evaluating alternatives and factors (e.g., resources, costs, tradeoffs).

Collaboration: Respects, listens to, and considers ideas/opinions of others from diverse backgrounds and experiences. Builds and maintains collaborative and trusting relationships with stakeholders within the team. Recognizes conflict or disputes among people and situations; seeks feedback and engages in open communication to resolve conflicts. Provides constructive and actionable feedback to others.

Citizenship: Enhances the effective functioning of Uber by participating in and promoting activities and efforts that contribute to the engineering and/or people culture in the team such as onboarding and mentoring new team members. Participates in internally-focused engagements (e.g., tech talks, open source, conferences, team building).

Minimum qualifications:
Bachelor’s degree or equivalent in Computer Science, Engineering, Mathematics or related field OR 1-year full-time Software Engineering work experience, WHICH INCLUDES 1-year total technical software engineering experience in one or more of the following areas:

Native iOS
iOS swift, iOS objective C

Note the 1-year total of specialized software engineering experience may have been gained through education and full-time work experience, additional training, coursework, research, or similar (OR some combination of these). The year of specialized experience is not necessarily in addition to the years of Education & full-time work experience indicated.

Technical skills:
Preferred:

Cross-platform (iOS and Android)

For Colorado-based applicants: Please refer to this role in our careers page for more details on your total compensation and benefits package. You can get there by clicking ‘apply’ if you’re not already on our careers site. #LI-Remote"
80,Front-End Web Developer - Staff or Senior - Toronto,EY,4.0,"Remote in Toronto, ON","Posted
Posted 26 days ago","At EY, you’ll have the chance to build a career as unique as you are, with the global scale, support, inclusive culture and technology to become the best version of you. And we’re counting on your unique voice and perspective to help EY become even better, too. Join us and build an exceptional experience for yourself, and a better working world for all.

EY's people in more than 140 countries around the globe pursue the highest levels of integrity, quality and professionalism to provide clients with solutions based on financial, transactional and risk-management knowledge in its core services of audit, tax and transaction services. We strive to help all of our people achieve both their professional and personal goals through an inclusive environment that values everyone's contributions, appreciates diversity of thought, fosters growth, and provides continuous opportunities for development. EY continually strives to be a great place to work.

The opportunity

We are currently recruiting to fill the role of Front-End Web Developer.

Your key responsibilities
Help to develop cutting edge, enterprise-scale ASP.NET web applications
Write high-quality, re-usable code in JavaScript, React, and Redux
Conceptualize and implement creative ideas for our core web platform
Test and improve the design of both existing and new websites
Contribute fresh, new ideas during developer meetings and other brainstorming sessions

Skills and attributes for success
Excellent interpersonal, communication, analytical, and problem-solving skills
Passion for technology and the ability to learn new technologies quickly and independently
Passion for creating beautiful and intuitive user interface designs
Ability to proactively manage commitments in a fast-paced environment

To qualify for this role, ideally you have
Proficiency in HTML, CSS, JavaScript (including ES2017 or higher), and JSON
Experience with JavaScript frameworks such as React and Redux
Working knowledge of CSS Preprocessors (Sass)
Knowledge of responsive web design
Ability to design, wireframe and prototype new ideas

Other beneficial skills
jQuery
Redux Observables
ASP.NET and C# Development
Restful API calls

Ideally, you’ll also have
Bachelor’s degree or Diploma in a related field

What we look for

Highly motivated individuals with the ability to prioritize shifting workloads. You’ll be a confident team player who collaborates with people from various teams while looking to develop your career in a dynamic organization.

What we Offer

At EY, our Total Rewards package supports our commitment to creating a leading people culture - built on high-performance teaming - where everyone can achieve their potential and contribute to building a better working world for our people, our clients and our communities. It's one of the many reasons we repeatedly win awards for being a great place to work.

We offer a competitive compensation package where you’ll be rewarded based on your performance and recognized for the value you bring to our business. In addition, our Total Rewards package allows you decide which benefits are right for you and which ones help you create a solid foundation for your future. Our Total Rewards package includes a comprehensive medical, prescription drug and dental coverage, a defined contribution pension plan, a great vacation policy plus firm paid days that allow you to enjoy longer long weekends throughout the year, statutory holidays and paid personal days (based on province of residence), and a range of exciting programs and benefits designed to support your physical, financial and social well-being. Plus, we offer:
Support and coaching from some of the most engaging colleagues in the industry.
Learning opportunities to develop new skills and progress your career.
The freedom and flexibility to handle your role in a way that’s right for you.

Make your mark. Apply today.

Diversity and Inclusion at EY

Diversity and inclusiveness are at the heart of who we are and how we work. We’re committed to fostering an environment where differences are valued, policies and practices are equitable, and our people feel a sense of belonging. From our actions to combat systemic racism and our advocacy for the LGBT+ community to our innovative Neurodiversity Centre of Excellence and Accessibility initiatives, we welcome and embrace the diverse experiences, abilities, backgrounds and perspectives that make our people unique and help guide us. Because when people feel free to be their authentic selves at work, they bring their best and are empowered to build a better working world.

EY Way of Work and your health and safety

EY Way of Work recognizes flexibility in the way we collaborate, innovate and deliver with the ability to work in-person and remotely. To support a healthy and safe in-person working environment, EY has implemented various layers of health and safety controls while working in the office or at client or other locations. A critical component of EY’s workplace safety program includes our COVID-19 vaccination policy which requires all personnel to be fully vaccinated against COVID-19 unless an accommodation based on a reason protected by human rights legislation is provided.

EY | Building a better working world

EY exists to build a better working world, helping to create long-term value for clients, people and society and build trust in the capital markets.

Enabled by data and technology, diverse EY teams in over 150 countries provide trust through assurance and help clients grow, transform and operate.

Working across assurance, consulting, law, strategy, tax and transactions, EY teams ask better questions to find new answers for the complex issues facing our world today."
