,0,1,2,3,4,5
40,Software Engineer (Remote),Romet Limited,3.7,Remote in Ontario,"Posted
Posted 30+ days ago","JOB TITLE: Software Engineer (Remote)
Location: Mississauga

Why you should come work with the Romet Team:
We offer market competitive salaries
Annual bonus plan
100% company paid benefits
Group pension plan
Training opportunities
Social events, a great team and more!

ROMET Limited was founded in 1972. Today, Romet is an international market leader that provides end-to-end measurement solutions to natural gas utilities across the globe by providing best-in-class technologies to meet our customers' needs now and 20 years from now. Our technological platforms are designed to seamlessly provide customer-centric measurement solutions. Our mission is centered on customer satisfaction through responsive deliveries, technical support and customer service that is matched with rugged and reliable products, manufactured with uncompromising quality, accuracy, and safety requirements. We will continue developing innovative technologies within the natural gas industry, promoting efficient, sustainable, and cost-effective energy solutions.
Romet is a collaborative organization where talent is combined with experience to drive our business toward success. This is made possible by the work ethic, creativity and passion of our team members and their continued commitment to delivering customer satisfaction. Our team is truly diverse with different areas of expertise and backgrounds, all guided by a team of experienced and innovative leaders. Romet has been recognized as a Gold winner for Best Managed Companies in Canada for six consecutive years.
We are currently looking for a Software Engineer to join our busy and growing manufacturing company. The successful candidate will be engaged in elevating the department and company to the next level. The incumbent will be forward looking and thrive in a culture of continuous improvement.
For the right person this is an exciting opportunity to be developed and invested in to become an integral member of the Product Development and Engineering team. We are looking for a highly motivated, focused, and outgoing person who wants to springboard their career with a thriving manufacturing company. You will be provided the coaching and training needed throughout the onboarding and orientation process that will build from your base of skills acquired from your past experiences.
You will learn our business during your training with our experts in Product Development, Engineering, Customer Experience, Sales, and Operations.
If you are excited at the prospect of joining an award winning, high growth, technically relevant organization this may be the opportunity you.

GENERAL ACCOUNTABILITY
Reporting directly to the Director of Product Development, the Software Engineer will be responsible for system design and planning sessions for the development and maintenance of production cloud services, to design and improve user interactions on Web and Mobile Applications, and for developing Native Web and Mobile Applications.

Key Job Responsibilities and Accountabilities:
Participate in system design and planning sessions for the development and maintenance of production applications
Build, design, and maintain new desktop and mobile applications
Evaluate existing applications to reprogram, update and add new features
Contribute to the design, architecture, development, modification, code review, and testing of key applications in the following areas: analytic dashboard and reporting, client facing applications.
Write reusable code to implement scalable and secure web services APIs
Work with SQL and NoSQL DB systems
Troubleshoot and debug applications
Document technical processes
All other duties and projects as assigned by the Director of Product Development
Skills and Qualifications:
Ability to program using C# and Java programming languages
Excellent mathematical, analytical, and problem-solving skills
Highly motivated self-starter, excellent organizational and time management skills
Ability to pick up new technology and concepts quickly
Ability to work under pressure in a fast-paced environment with tight deadlines
Attention to detail and accuracy
Ability to work independently and in a team (good team player)
Ability to debug and resolve development issues
Excellent interpersonal, communication (written and verbal) skills
Understanding of IoT devices and use cases in a large network environment such as data ingestion, analytics, visualization, processing, and security
Educational/Experience Requirements:
Bachelor’s Degree in Computer Science/Engineering
4+ years of experience as a Web and Mobile Application Developer
Experience developing desktop and mobile applications using C#, Java, and Swift
Experience developing hybrid and native mobile applications using one or more of; React native, Flutter Xamarin, Ionic, Java, and Swift
Familiarity with JSON Web Token for authentication and authorization
Experience with Back-end development using languages; Java, Python, Node.js, and frameworks; Django and Express.js
Experience with Front-end development using languages; HTML5, CSS, JavaScript, and TypeScript.
Experience with React library and Angular framework
Experience with CRUD Database technologies like MySQL, PostgreSQL
Experience tracking and managing changes to software code using version control systems
Considered an asset:
Development and programming experience on AWS environment, utilizing different AWS services, and deploying the application in AWS, enhancing and monitoring AWS solutions in compliance with IT policies, procedures, standards, and guidelines
Experience using AWS Services; Lambda, Kinesis and CloudWatch
Experience with design, creation, and modification API Gateway, RESTful and GraphQL APIs
Experience with CRUD Database technologies like MongoDB and DynamoDB
Familiarity with S3 and CloudFront as a Content Delivery Network for SPA deployment
Skills
Required
Python
Java
IoT Platforms (Azure IoT, AWS IoT)
Embedded Systems Software Design
Django
C/C++
API Design
AWS/SCP Platforms
Behaviors
Required
Team Player: Works well as a member of a group
Functional Expert: Considered a thought leader on a subject
Detail Oriented: Capable of carrying out a given task with all details necessary to get the task done well
Dedicated: Devoted to a task or purpose with loyalty or integrity
Motivations
Required
Self-Starter: Inspired to perform without outside help
Peer Recognition: Inspired to perform well by the praise of coworkers
Job Security: Inspired to perform well by the knowledge that your job is safe
Goal Completion: Inspired to perform well by the completion of tasks
Entrepreneurial Spirit: Inspired to perform well by an ability to drive new ventures within the business
Ability to Make an Impact: Inspired to perform well by the ability to contribute to the success of a project or the organization"
41,DevOps Engineer,SnapPay,404,"Mississauga, ON","Employer
Active 4 days ago","About the Role
We are looking for a DevOps Engineer to join the Tech team. As a DevOps Engineer, you will be responsible for service delivery, reliability, scalability, monitoring, and helping define all of this as immutable infrastructure-as-code in our AWS environment. Your contributions will help our team ensure we can provide our customers with incredible value and further our cause!
You Will:
Provide technical support for immediate and ongoing infrastructure problems.
Provide support for services go-live, including planning, development and test support, production deployment, and post go-live review.
Maintain services once they are live by measuring and monitoring availability, latency and overall system health.
Partner with product development and testing teams in order to provide domain expertise around infrastructure design, security, and observability.
Automate manual business and operational processes.
Continuously evaluate and tune the monitoring and alerting to enable proactive incident management.
Improve the effectiveness and security of the system infrastructure.
Research new technologies and incorporate them into existing service when necessary.
Able to accommodate flexible hours and participate in ad-hoc support.
Qualifications
Bachelor’s degree in Computer Science, or a related technical field involving coding or equivalent practical experience.
Minimum 5 years of experience with DevOps practices in Cloud environment.
Experience with medium or large-scale infrastructure.
Strong experience with AWS (AWS Certification is preferred).
Knowledge about Kubernetes, docker, and containerization.
Experience with Hashicorp Terraform or similar technologies.
Basic experience in coding languages, such as Java, Python, Groovy, NodeJS, Golang or similar.
Hands-on experience in Jenkins, CircleCI, or other build pipeline tools.
A keen interest in information security and associated tooling.
A positive attitude, with the willingness to learn and collaborate.
Job Type: Full-time
Salary: $80,000.00-$110,000.00 per year
Benefits:
Dental care
Extended health care
Schedule:
8 hour shift
Supplemental pay types:
Bonus pay
Ability to commute/relocate:
Mississauga, ON: reliably commute or plan to relocate before starting work (preferred)
Experience:
DevOps: 5 years (preferred)"
42,PHP Developer,AgencyAnalytics,404,"Remote in Toronto, ON",Hiring ongoing,"We’re looking for a PHP Developer to join our Platform group, responsible for driving the systems that enable our user's most important features
As part of platform, you'll be developing and operating a wide range of backend functions and tools that enable the features our users love. Together with the team, you'll work remotely to implement architectural changes, drive platform stability, research new technologies and continuously advocate for the use of best practices. You'll frequently work with other engineering teams to deliver incremental product improvements and new features
This position is 100% remote and only eligible for those who are authorized to work in Canada.
What You'll Do
Design, develop and iterate on backend services that handle millions of requests per day
Develop and maintain platform components that enable our core product features
Collaborate with engineering leaders to determine how to reliably scale backend systems
Use a hands on approach to research, measure and improve application performance
Work with infrastructure engineers to collaboratively plan and maintain tools that underpin our developer experience
Work closely with leadership to identify and solve architectural and technological challenges
Salary
$100,000 - $120,000 CAD
Job requirements
You have several years of experience with PHP 7+
You have experience with modern cloud storage solutions such as BigQuery
You are focused around quality and supporting others to maintain a high standard
You have an understanding of system design and can quickly scope out projects
You are comfortable around modern infrastructure tooling and understand how infrastructure relates to software development
You learn fast and are eager to experiment, research and test new technologies to validate how they can be used to fulfill company goals
Job Benefits
Profit-sharing, distributed quarterly
Frequent promotions
4 weeks vacation and paid sick days
Happy Hour once a month
Extended health benefits
Continued education allowance
Annual fitness allowance
Work from anywhere in the world
Join a bootstrapped, product-focused, & customer-oriented team
About AgencyAnalytics
AgencyAnalytics is a reporting platform that helps digital agencies automate their client reporting.
Based in Toronto, we have been in business since 2010, are 100% employee-owned, and are growing fast. AgencyAnalytics is currently one of the few high-growth companies selected to participate in the Lazaridis ScaleUp program.
On top of being obsessed with building the best product possible and helping our customers succeed, we also pride ourselves on our company culture. From weekly happy hours, employee of the month awards, profit sharing, fitness allowances, and continued learning...we’re always looking for ways to take care of our team.
For anyone looking to continue building their career in SaaS, this is an opportunity to join a team that is dedicated to building a company you’ll want to stay at for years to come.
AgencyAnalytics is an equal opportunity employer. We are committed to providing an environment of mutual respect where equal opportunities are available to all applicants regardless of race, color, religion, sex, age, marital status, gender identity, and any other characteristic protected by applicable law. We celebrate diversity and are committed to an inclusive environment among our team.
Job Type: Full-time
Salary: $100,000.00-$120,000.00 per year
Work Location: One location"
43,QA Automation Engineer Job,Telus,3.9,Canada,"Employer
Active 5 days ago","We are seeking a talented QA automation engineer for our Telus TV asset management system.
In this role, you will create automated scripts and update existing scripts to validate the AMS functions, and collaborate with the software design team.
QA Automation Engineer Responsibilities:
Meeting with the software design team to discuss verification protocols.
Identifying software application weaknesses and target areas.
Sketching out ideas for automated software test procedures.
Reviewing software bug reports and highlighting problem areas.
Identifying quality issues and creating test reports.
Collaborating with the design team to solve application faults.
QA Automation Engineer Requirements:
Bachelor’s degree in computer science, software engineering, or a similar field.
Previous experience working as a QA automation engineer.
Previous experience with Selenium, WebDriver
Familiarity with programming script languages including C# and Java
Excellent analytical skills.
Detailed knowledge of application functions, bug fixing, and testing protocols.
Good written and verbal communication skills.
Strong attention to detail.
Good project management skills.
Job Type: Permanent
Salary: $90,000.00-$100,000.00 per year
Schedule:
8 hour shift
Experience:
quality assurance: 7 years (required)
Selenium: 5 years (required)
Java: 4 years (required)
Api Automation: 3 years (required)
Application deadline: 2022-08-01"
44,"Developer (New Grad Role), Fall 2022 Start",BMO Financial Group,3.8,"Toronto, ON","Posted
Posted 30+ days ago","YSC - 2 Sheppard Avenue East Toronto Ontario,M2N 5Y7
Job Description
Digital Core delivers many digital platforms and services across the enterprise supporting many line of businesses. Operational Excellence team focus on identifying improvement opportunities, developing framework module, streamlining / automating processes, and promoting best practice to the development team. As we continue developing sophisticated solution, the complexity increase, and there are always room for improvement. It is critical to continuously review the overall development experience, quality, delivery, and support to identify improvement opportunities. This team support Digital Core development teams on continuous improvement stream, vendor relationship, and support the team to improve their working experience
Key Accountabilities
Identify development and deployment process improvement opportunity
Conduct independent analysis and assessment on existing process / technology
Interact with technology stakeholders to understand the requirement and integrated system / solution
Design, develop, and test solution to automate and streamline manual process
Work collaboratively with development teams, cloud engineering, and other technology partners
Support assessment of incorporating various AWS technology / features
Documents the requirement, detail technical design, and supporting materials
Utilize various DevOps tools to deliver projects / products systematically, enabling continue integration, automated testing, rapid features delivery
Stays abreast of industry technical and business trends through participation in professional association, practice communities and individual learning
Qualifications:
Bachelor’s degree in computer science or a related field
2-5 years of work experience in related fields.
Knowledge of software development practices, concepts, and technology obtained through formal training and/or work experience
Demonstrate solid foundational development knowledge with TypeScript, Python, Java, JavaScript, or similar programing languages
Self-motivated, customer focus, delivery focus, and willing to take ownership
Experience with DevOps tool, such as JIRA, BitBucket, Bamboo, would be an asset
Demonstrate strong analytical skill, and problem-solving approach
Demonstrate strong organization skill
Communication skills for both a technical and business audience
Relate well to people from variety of backgrounds
We’re here to help
At BMO we are driven by a shared Purpose: Boldly Grow the Good in business and life. It calls on us to create lasting, positive change for our customers, our communities and our people. By working together, innovating and pushing boundaries, we transform lives and businesses, and power economic growth around the world.
As a member of the BMO team you are valued, respected and heard, and you have more ways to grow and make an impact. We strive to help you make an impact from day one – for yourself and our customers. We’ll support you with the tools and resources you need to reach new milestones, as you help our customers reach theirs. From in-depth training and coaching, to manager support and network-building opportunities, we’ll help you gain valuable experience, and broaden your skillset.
To find out more visit us at https://jobs.bmo.com/ca/en
BMO is committed to an inclusive, equitable and accessible workplace. By learning from each other’s differences, we gain strength through our people and our perspectives. Accommodations are available on request for candidates taking part in all aspects of the selection process. To request accommodation, please contact your recruiter.
Note to Recruiters: BMO does not accept unsolicited resumes from any source other than directly from a candidate. Any unsolicited resumes sent to BMO, directly or indirectly, will be considered BMO property. BMO will not pay a fee for any placement resulting from the receipt of an unsolicited resume. A recruiting agency must first have a valid, written and fully executed agency agreement contract for service to submit resumes."
45,Full Stack Developer,OMERS,3.3,"Toronto, ON","Posted
Posted 16 days ago","Why join us?
We are looking for highly skilled React and Node developers that are comfortable with NextJS to join our Products & Technology team in Toronto. We are interested in building world class products in a collaborative environment of mutual respect. “Try and fail fast”, “Data over opinion”, “Rapid iteration” are some of our core values. We are looking for people who can help us progress toward our vision, if that person is you, please consider applying.

Technologies we use by time spent in day-to-day work:
ReactJS
Next.js (CSR, SSR and SSG)
Jest unit testing (including snapshots)
Redux (thunks and sagas)
TypeScript
Express knowledge for occasional back-end for front-end API development
Working with DevOps to manage our applications. They deploy our applications using:
GCP
Docker
Some concepts you will need to know:
React state management (thunk, saga, rxjs)
Pros and cons of Promises vs Rx vs Async Await vs Generators
ES6 paradigms and advanced javascript knowledge
Functional programming, it’s benefits and uses
Best practices of authorization and security
How to lay out the page using flexbox, css-grid
Using CSS pre-processors
How to separate concerns of data, logic, rendering
How to balance convenience and flexibility
What fosters developer growth and how to help developers grow
Resolving interpersonal conflicts with a positive growth mindset
How to effectively engage the business and balance time pressure and maintainability
What is leadership and why people would follow you as their leader
As a Full Stack Developer you are part of a 20-person front-end development chapter, and part of a product team of 10-14 that had 2-6 developers depending on the team.
If you are so inclined, in addition to day-to-day software work, you can also help with cross-product areas by joining guilds. Guilds are areas of subject-knowledge that are relevant to teams at OMERS, such as accessibility, design, testing, and interviews. We centralize discussions to form “OMERS best practice” and make recommendations to teams.

To succeed in this role, you have:
Undergraduate degree, equivalent, or years of proven development experience
Minimum of 3 years of professional React experience
Wide breadth of experience in various company settings
Strong interpersonal skills and some conflict resolution experience
Our story:
Founded in 1962, OMERS is one of Canada’s largest defined benefit pension plans, with $121 billion in net assets as at December 31, 2021. OMERS is a jointly-sponsored pension plan, with 1,000 participating employers ranging from large cities to local agencies, and over half a million active, deferred and retired members. OMERS members include union and non-union employees of municipalities, school boards, local boards, transit systems, electrical utilities, emergency services and children’s aid societies across Ontario. Contributions to the Plan are funded equally by members and employers. OMERS teams work in Toronto, London, New York, Amsterdam, Luxembourg, Singapore, Sydney and other major cities across North America and Europe – serving members and employers and originating and managing a diversified portfolio of high-quality investments in public markets, private equity, infrastructure and real estate.

OMERS is committed to having a workforce that reflects the communities in which we live and work. We are an equal opportunity employer committed to a barrier-free recruitment and selection process. At OMERS inclusion and diversity means belonging. How we create a sense of belonging is through our employees and our vast network of Employee Resource Groups. Whether you are passionate about gender, pride, or visible minorities, we have groups that are focused on making a difference in all of our lives.

Vaccination Policy

At OMERS and Oxford the office or worksite is our primary place of work. We are committed to providing work environments which promote the health, safety and well-being of all employees in accordance with public health regulation and guidance. Accordingly, employees are required to provide evidence of full vaccination or have an approved exemption."
